{
  "kind": "START",
  "bank": {
    "version": 1,
    "questions": [
      {
        "question_id": "Q1.D01",
        "name": "Q1.D01",
        "order": 1,
        "prerequisite": null,
        "question_sentence": "혹시 뇌졸중으로 진단받으셨거나 현재 약물 치료 중이신가요?",
        "refusal_explanation": "답하기 어려우시면 넘어가셔도 됩니다.",
        "guide_sentences": [],
        "affected_followups": [],
        "policy": {
          "question_limit": 3,
          "unknown_accept_after": 2,
          "refusal_accept_after": 2
        },
        "repeat_keys": [],
        "slots": [
          {
            "slot_id": "diagnosed",
            "units": [],
            "choices": [],
            "yes_no_map": null,
            "required": true,
            "reask_sentence": "diagnosed을(를) 다시 말씀해 주세요.",
            "risk_rule": null,
            "data_type": "boolean"
          },
          {
            "slot_id": "on_medication",
            "units": [],
            "choices": [],
            "yes_no_map": null,
            "required": true,
            "reask_sentence": "on_medication을(를) 다시 말씀해 주세요.",
            "risk_rule": null,
            "data_type": "boolean"
          }
        ]
      },
      {
        "question_id": "Q1.D02",
        "name": "Q1.D02",
        "order": 2,
        "prerequisite": null,
        "question_sentence": "혹시 심근경색이나 협심증으로 진단받으셨거나 현재 약물 치료 중이신가요?",
        "refusal_explanation": "답하기 어려우시면 넘어가셔도 됩니다.",
        "guide_sentences": [],
        "affected_followups": [],
        "policy": {
          "question_limit": 3,
          "unknown_accept_after": 2,
          "refusal_accept_after": 2
        },
        "repeat_keys": [],
        "slots": [
          {
            "slot_id": "diagnosed",
            "units": [],
            "choices": [],
            "yes_no_map": null,
            "required": true,
            "reask_sentence": "diagnosed을(를) 다시 말씀해 주세요.",
            "risk_rule": null,
            "data_type": "boolean"
          },
          {
            "slot_id": "on_medication",
            "units": [],
            "choices": [],
            "yes_no_map": null,
            "required": true,
            "reask_sentence": "on_medication을(를) 다시 말씀해 주세요.",
            "risk_rule": null,
            "data_type": "boolean"
          }
        ]
      },
      {
        "question_id": "Q1.D03",
        "name": "Q1.D03",
        "order": 3,
        "prerequisite": null,
        "question_sentence": "다음은 고혈압입니다. 진단받은 적이 있으신지, 지금 약을 드시는지 알려 주세요.",
        "refusal_explanation": "답하기 어려우시면 넘어가셔도 됩니다.",
        "guide_sentences": [],
        "affected_followups": [],
        "policy": {
          "question_limit": 3,
          "unknown_accept_after": 2,
          "refusal_accept_after": 2
        },
        "repeat_keys": [],
        "slots": [
          {
            "slot_id": "diagnosed",
            "units": [],
            "choices": [],
            "yes_no_map": null,
            "required": true,
            "reask_sentence": "diagnosed을(를) 다시 말씀해 주세요.",
            "risk_rule": null,
            "data_type": "boolean"
          },
          {
            "slot_id": "on_medication",
            "units": [],
            "choices": [],
            "yes_no_map": null,
            "required": true,
            "reask_sentence": "on_medication을(를) 다시 말씀해 주세요.",
            "risk_rule": null,
            "data_type": "boolean"
          }
        ]
      },
      {
        "question_id": "Q1.D04",
        "name": "Q1.D04",
        "order": 4,
        "prerequisite": null,
        "question_sentence": "Q1.D04 문항입니다. 알려 주세요.",
        "refusal_explanation": "답하기 어려우시면 넘어가셔도 됩니다.",
        "guide_sentences": [],
        "affected_followups": [],
        "policy": {
          "question_limit": 3,
          "unknown_accept_after": 2,
          "refusal_accept_after": 2
        },
        "repeat_keys": [],
        "slots": [
          {
            "slot_id": "diagnosed",
            "units": [],
            "choices": [],
            "yes_no_map": null,
            "required": true,
            "reask_sentence": "diagnosed을(를) 다시 말씀해 주세요.",
            "risk_rule": null,
            "data_type": "boolean"
          },
          {
            "slot_id": "on_medication",
            "units": [],
            "choices": [],
            "yes_no_map": null,
            "required": true,
            "reask_sentence": "on_medication을(를) 다시 말씀해 주세요.",
            "risk_rule": null,
            "data_type": "boolean"
          }
        ]
      },
      {
        "question_id": "Q1.D05",
        "name": "Q1.D05",
        "order": 5,
        "prerequisite": null,
        "question_sentence": "Q1.D05 문항입니다. 알려 주세요.",
        "refusal_explanation": "답하기 어려우시면 넘어가셔도 됩니다.",
        "guide_sentences": [],
        "affected_followups": [],
        "policy": {
          "question_limit": 3,
          "unknown_accept_after": 2,
          "refusal_accept_after": 2
        },
        "repeat_keys": [],
        "slots": [
          {
            "slot_id": "diagnosed",
            "units": [],
            "choices": [],
            "yes_no_map": null,
            "required": true,
            "reask_sentence": "diagnosed을(를) 다시 말씀해 주세요.",
            "risk_rule": null,
            "data_type": "boolean"
          },
          {
            "slot_id": "on_medication",
            "units": [],
            "choices": [],
            "yes_no_map": null,
            "required": true,
            "reask_sentence": "on_medication을(를) 다시 말씀해 주세요.",
            "risk_rule": null,
            "data_type": "boolean"
          }
        ]
      },
      {
        "question_id": "Q1.D06",
        "name": "Q1.D06",
        "order": 6,
        "prerequisite": null,
        "question_sentence": "Q1.D06 문항입니다. 알려 주세요.",
        "refusal_explanation": "답하기 어려우시면 넘어가셔도 됩니다.",
        "guide_sentences": [],
        "affected_followups": [],
        "policy": {
          "question_limit": 3,
          "unknown_accept_after": 2,
          "refusal_accept_after": 2
        },
        "repeat_keys": [],
        "slots": [
          {
            "slot_id": "diagnosed",
            "units": [],
            "choices": [],
            "yes_no_map": null,
            "required": true,
            "reask_sentence": "diagnosed을(를) 다시 말씀해 주세요.",
            "risk_rule": null,
            "data_type": "boolean"
          },
          {
            "slot_id": "on_medication",
            "units": [],
            "choices": [],
            "yes_no_map": null,
            "required": true,
            "reask_sentence": "on_medication을(를) 다시 말씀해 주세요.",
            "risk_rule": null,
            "data_type": "boolean"
          }
        ]
      },
      {
        "question_id": "Q1.D07",
        "name": "Q1.D07",
        "order": 7,
        "prerequisite": null,
        "question_sentence": "Q1.D07 문항입니다. 알려 주세요.",
        "refusal_explanation": "답하기 어려우시면 넘어가셔도 됩니다.",
        "guide_sentences": [],
        "affected_followups": [],
        "policy": {
          "question_limit": 3,
          "unknown_accept_after": 2,
          "refusal_accept_after": 2
        },
        "repeat_keys": [],
        "slots": [
          {
            "slot_id": "diagnosed",
            "units": [],
            "choices": [],
            "yes_no_map": null,
            "required": true,
            "reask_sentence": "diagnosed을(를) 다시 말씀해 주세요.",
            "risk_rule": null,
            "data_type": "boolean"
          },
          {
            "slot_id": "on_medication",
            "units": [],
            "choices": [],
            "yes_no_map": null,
            "required": true,
            "reask_sentence": "on_medication을(를) 다시 말씀해 주세요.",
            "risk_rule": null,
            "data_type": "boolean"
          }
        ]
      },
      {
        "question_id": "Q1.D08",
        "name": "Q1.D08",
        "order": 8,
        "prerequisite": null,
        "question_sentence": "Q1.D08 문항입니다. 알려 주세요.",
        "refusal_explanation": "답하기 어려우시면 넘어가셔도 됩니다.",
        "guide_sentences": [],
        "affected_followups": [],
        "policy": {
          "question_limit": 3,
          "unknown_accept_after": 2,
          "refusal_accept_after": 2
        },
        "repeat_keys": [],
        "slots": [
          {
            "slot_id": "diagnosed",
            "units": [],
            "choices": [],
            "yes_no_map": null,
            "required": true,
            "reask_sentence": "diagnosed을(를) 다시 말씀해 주세요.",
            "risk_rule": null,
            "data_type": "boolean"
          },
          {
            "slot_id": "on_medication",
            "units": [],
            "choices": [],
            "yes_no_map": null,
            "required": true,
            "reask_sentence": "on_medication을(를) 다시 말씀해 주세요.",
            "risk_rule": null,
            "data_type": "boolean"
          }
        ]
      },
      {
        "question_id": "Q1.D09",
        "name": "Q1.D09",
        "order": 9,
        "prerequisite": null,
        "question_sentence": "Q1.D09 문항입니다. 알려 주세요.",
        "refusal_explanation": "답하기 어려우시면 넘어가셔도 됩니다.",
        "guide_sentences": [],
        "affected_followups": [],
        "policy": {
          "question_limit": 3,
          "unknown_accept_after": 2,
          "refusal_accept_after": 2
        },
        "repeat_keys": [],
        "slots": [
          {
            "slot_id": "diagnosed",
            "units": [],
            "choices": [],
            "yes_no_map": null,
            "required": true,
            "reask_sentence": "diagnosed을(를) 다시 말씀해 주세요.",
            "risk_rule": null,
            "data_type": "boolean"
          },
          {
            "slot_id": "on_medication",
            "units": [],
            "choices": [],
            "yes_no_map": null,
            "required": true,
            "reask_sentence": "on_medication을(를) 다시 말씀해 주세요.",
            "risk_rule": null,
            "data_type": "boolean"
          }
        ]